{
  "promotion_decision_version": "1.0",
  "decision_id": "corpus-case-only-example",
  "decision": "corpus_case_only",
  "rationale": "The scheduled-maintenance retry surface shares its root cause with retry-jitter-defect and contributes a genuinely distinct trigger and surface, so it is retained without double-counting - but one additional surface for an already-known rule does not by itself justify a new rubric or repository-instruction change. It becomes a corpus case only. This is a synthetic worked example.",
  "positive_case_ids": ["retry-jitter-duplicate-with-new-surface"],
  "negative_control_case_ids": [],
  "evidence": {
    "before": {
      "recall": 0.9,
      "false_positive_rate": 0.05,
      "stability": 0.9,
      "latency_seconds": 33.1,
      "cost": { "usd": 0.87 }
    },
    "after": {
      "recall": 0.9,
      "false_positive_rate": 0.05,
      "stability": 0.9,
      "latency_seconds": 33.1,
      "cost": { "usd": 0.87 }
    }
  }
}
