{
  "promotion_decision_version": "1.0",
  "decision_id": "repository-instruction-promotion-example",
  "decision": "repository_instruction_update",
  "rationale": "The config-loader migration miss is specific to this repository's own schema-migration convention, not a repository-independent invariant, so the narrowest owner is this repository's existing instruction mechanism rather than the global rubric. This is a synthetic worked example proving the promotion schema's existing-mechanism gate; it does not itself edit AGENTS.md.",
  "positive_case_ids": ["stale-config-schema-defect"],
  "negative_control_case_ids": ["cache-ttl-false-positive"],
  "target": {
    "kind": "repository_instruction",
    "path": "AGENTS.md",
    "summary": "Note, beside this repository's existing schema-migration guidance, that a renamed config field must be rejected rather than silently defaulted."
  },
  "evidence": {
    "before": {
      "recall": 0.5,
      "false_positive_rate": 0.15,
      "stability": 0.75,
      "latency_seconds": 30.2,
      "cost": { "usd": 0.6 }
    },
    "after": {
      "recall": 1.0,
      "false_positive_rate": 0.1,
      "stability": 0.85,
      "latency_seconds": 30.8,
      "cost": { "usd": 0.62 }
    }
  }
}
